{
  "id": "LGD-0041",
  "title": "Steam beta update kills mouse input in Gamescope",
  "category": "input_controller",
  "symptom": "Steam client regression affects Gamescope input",
  "classification": "WORKAROUND",
  "evidence_status": "REPORTED",
  "source_hint": "Canonical corpus seed; source URLs are attached during evidence-ingestion phases.",
  "preconditions": [],
  "probes": [
    "steam_channel_state",
    "stable_beta_ab",
    "gamescope_input_state"
  ],
  "mutation_policy": "REVERSIBLE",
  "verification": [
    "stable_passes_beta_fails"
  ],
  "rollback": [
    "restore_pre_test_state"
  ],
  "notes": "P00 seed record. Do not promote REPORTED/UNCONFIRMED evidence to confirmed without source review and reproduction."
}
