{
  "id": "LGD-0030",
  "title": "Gamescope lowers FPS versus normal compositor",
  "category": "performance",
  "symptom": "Gamescope path introduces performance loss",
  "classification": "WORKAROUND",
  "evidence_status": "REPORTED",
  "source_hint": "Canonical corpus seed; source URLs are attached during evidence-ingestion phases.",
  "preconditions": [],
  "probes": [
    "native_compositor_benchmark",
    "gamescope_benchmark"
  ],
  "mutation_policy": "REVERSIBLE",
  "verification": [
    "native_path_is_faster"
  ],
  "rollback": [
    "restore_pre_test_state"
  ],
  "notes": "P00 seed record. Do not promote REPORTED/UNCONFIRMED evidence to confirmed without source review and reproduction."
}
